text,label
j j helps boost blue chips new york reuters us blue chips rose on thursday boosted by johnson johnson lta href targetstocksquickinfofullquotegtjnjnltagt following its move to buy guidant corp lta href targetstocksquickinfofullquotegtgdtnltagt but market gains were limited after goldman sachs posted disappointing revenues,two
jpeg exploit could beat antivirus software security experts say that attacks using image files could bypass established defenses,three
blazers nets reportedly discussing kidd trade the new jersey nets and the portland trailblazers have discussed a trade involving superstars jason kidd and shareef abdurrahim according to a published internet report,one
sony and nvidia develop sony computer entertainment inc and nvidia corporation today announced that the companies have been collaborating to develop the graphics processing unit for the playstation in the future the experience,three
walmart s vice chairman retires london december newratingscom walmart stores wmtnys announced yesterday that its vice chairman thomas coughlin would retire on january after having served the company for years,two
nd update hutchison telecom debut pales vs china power hong kong dow joneshutchison telecommunications international ltd s hk debut on the hong kong stock exchange friday paled in comparison to china power international,two
dixons pulls the plug on vcr sales high street electrical retailer dixons has pulled the plug on the vcr and announced today video recorders will disappear from its shelves before christmas,three
eads superjumbo runs over budget european aerospace giant eads warns that the a superjumbo project is running heavily over budget,two
american duo wins opening beach volleyball match athens reuters american misty may gave team mate kerri walsh an ideal th birthday present with an easy victory over japan in their opening match of the olympics beach volleyball tournament on sunday,one
global markets euro eases from london reuters the euro lta href targetstocksquickinfofullquotegteurltagt made a renewed attempt to test the key psychological level of on tuesday but lacked fundamental impetus and eased back after data showed a dollarfriendly improvement in us net capital inflows,two
iu names hoeppner football coach miami of ohio football coach terry hoeppner will be named the next football coach at indiana university sources confirmed early today,one
undermanned pacers trim raptors cbc sports online if eric williams and aaron williams are tough on the boards and have a magic potion to win on the road they ll be an instant hit with toronto raptors fans,one
suzuki sets record but would rather have playoff spot anaheim s ltbgtltbgt cp ichiro suzuki has the singleseason hits record but he d much rather have the playoff spot bartolo colon and the anaheim angels are one game closer to securing,one
saturday s top capsules jason campbell threw a yard scoring pass to courtney taylor with to play and no auburn got two chances to kick the winning extra point in a victory over no,one
apache opensource groups wary of sender id the apache foundation pulls support for the antispam technology because of microsofts license requirements,three
search engine forums spotlight links to this weeks topics from search engine forums across the web clickfraud said to be of clicks ppc pay per click and affiliate marketing will it last press releases for link development new adwords traffic estimator adwords is broadmatch really bad marketing tactics with shopping search engines how to optimize pdfs,three
winless cardinals winning turnover game ap ap the arizona cardinals are winless in three games but they are among the league leaders in one category taking the ball away from the opponent,one
bike bomb kills at least in pakistan assailants set off a powerful time bomb next to an army truck parked in a teeming outdoor market in southwestern pakistan on friday killing at least people and injuring,zero
lisbie saves charlton s centenary celebrations given the nostalgia surrounding yesterday s game at the valley it would have been cruel to deny charlton at least a point so a draw in the rain of southeast london was a fair result,one
gay happy to get his chance patriots right cornerback randall gay realizes he has been the oppositions no target and will remain so in sunday nights game against buffalo,one
ravens patriots keys to the game the baltimore ravens have a prime opportunity to exploit the new england patriots vulnerable secondary in today s game at gillette stadium,one
sharapova humbled by resurgent pierce new york reuters the maria sharapova bandwagon came to a grinding halt on saturday when mary pierce rolled back the years with a sensational win in the third round of the us open,one
arafat says palestinians made mistakes ap ap in a rare admission yasser arafat suggested wednesday that the palestinian leadership has made mistakes and promised to correct them,zero
us economy recovery slows leading indicators drop new york ap offering more evidence that the us economic recovery is losing steam a closely watched gauge of future business activity has fallen for the second consecutive month,two
astronomers see galactic dance astronomers reveal one of the clearest images obtained of stephans quintet,three
sprint deal raises sponsorship questions wireless telephone company nextel communications confirmed wednesday it is being bought by rival sprint in a cash and stock deal said to be worth more than billion us,two
arafat is in coma between life and death spokeswoman says yasir arafat is not brain dead his spokeswoman said as palestinian officials met to consider a future without him,zero
arafat condition improves illness still a mystery paris palestinian officials say a medical report on yasser arafat s condition will be issued tomorrow or wednesday they say he s not suffering quotfrom any serious problem,zero
chechens basayev takes responsibility for russian school siege chechen rebel shamil basayev claimed responsibility for this month s hostagetaking at a russian school in which at least died and for four other terrorist attacks in recent weeks according to a rebel web site,zero
china to lead recovey in air travel industry geneva china is expected to be the world s fastestgrowing market for air travel as the world s airlines look for global growth in passenger traffic of percent annually over the next four years the top industry body said on wednesday,two
explosions at protest rally in bangladesh kill several explosions ripped through a bangladeshi opposition party rally here on saturday killing at least people and wounding as,zero
brother of exmexico president found dead ap ap enrique salinas the youngest brother of former mexican president carlos salinas de gortari was found dead in a car on the outskirts of mexico city on monday with a plastic bag tied over his head in an apparent murder officials said,zero
shire boosted by us approval of kidney drug fosrenol is shires biggest new drug hope as it looks to reduce its reliance on hyperactivity drug adderall xr which accounts for about percent of revenues but could face cheap generic competition from or,two
federer sweeps past hewitt houston federer fatigue not as long as roger federer keeps dominating mens tennis in style rarely have an extended series of mismatches been more pleasing to the eye and those few thousand fans who,one
open season on others ideas free riders have hit the jackpot in the digital revolution and wed better deal with it,three
expansion alters format with the expansion of the acc the mens basketball schedule will not incorporate the double round robin format in which each school plays every other twice,one
oil prices fall as market forecasts enough heating fuel london oil prices fell as markets reckoned on there being enough heating fuel to meet demand in key markets once winter arrives despite further drops in us stockpiles analysts said,two
overtime rules go in effect monday whether they ve been ready for months or are frantically working overtime to catch up employers of all stripes have until monday to conform to new labor regulations,two
link to pigs edges birdflu closer to pandemic the specter of a global influenza pandemic has loomed a little larger in recent weeks with revelations that chinese researchers found the deadly hn virus strain last year in pigs a crucial link in the mutation of the disease to a form that can infect,zero
rain drowns australianindia at amstelveen triangular torrential rain forced officials to abandon australia s oneday match against india in the amstelveen triangular tournament on monday wasting australia s innings of for seven and awarding both sides three points for,one
debate draws distinctions in candidates trade policies at a bushkerry trade debate wednesday standins for president bush and democratic challenger sen john f kerry outlined the candidates differences on such issues as outsourcing and free trade,three
americans wake up on day of ryder cup bloomfield township mich the americans finally showed up at the ryder cup,zero
prospect of no nhl season causing carnage in canada toronto the prospect of a winter without icehockey continues to send shockwaves across canada but the labour dispute between national hockey league nhl owners and players has caused barely a ripple in the united states,one
ukraine vote a threat to west ukraine s extremely important national elections tomorrow are causing deep concern among canada s ethnic ukrainian communities and far too late in europe and the united states,zero
report artists find internet useful but criticize filesharing com while recording and film industry interests have hammered away at the sharing of music and videos files over the internet the creative artists who actually produce the content welcome the internet,three
lions defenders get after warner like a big reallife buddha he slumped on the stool in front of his locker stall espousing to his audience how it was that a detroit lions team that entered this,one
macromedia stretches flexs features the company expands its server software for creating slick interfaces for web applications,three
ntt docomo motorola tie up on g handsets ntt docomo will release a handset compatible with nonjapanese cellular networks and with its own g third generation mobile network early next year,three
us seeks seouls support for hard line on nkorea seoul reuters secretary of state colin powell is to seek south korean support tuesday for a us hard line on north korea after china said washington must be more flexible to entice the reclusive state back to nuclear arms talks,zero
jp morgan cancels bn ibm outsourcing deal financial services firm jp morgan chase has cancelled a groundbreaking bn outsourcing deal with ibm which was intended to run for seven years,three
ukraine rivals bid to end crisis presidential rivals viktor yushchenko and viktor yanukovych meet in a fresh bid to resolve the poll crisis,zero
constellation brands seeks to buy mondavi constellation brands inc stzn quote profile research on tuesday said it has offered to buy robert mondavi corp mondo quote profile research for about million looking to add to its wine portfolio,two
serial ata for mini hard drives planned lord_slepnir writes quotcnet is reporting on a consortium of compainies that wish to develop a serial ata hard drive interface for miniature hard drives called ceata,three
battle brews over california emissions rule automakers suv owners and the federal government may balk at the state s latest effort to curb air pollution by daniel b wood staff writer of the christian science monitor,three
dillon experiences a whole new feeling there werent many times during the course of his cincinnati bengals career when corey dillon left the locker room satisfied after a game,one
walchhofer leads austrian superg sweep val gardena italy reuters the empire struck back in the mens ski world cup on friday with michael walchhofer winning the superg as a trio of austrians pushed overall leader bode miller off the val gardena podium,one
dollar mixed before us economic data new york reuters the dollar was mixed on monday as dealers grew slightly apprehensive of two key us economic indicators due on tuesday,two
verizon q profit flat verizon communications incs thirdquarter profit held steady at about billion as declining revenues from traditional phone services at the nations biggest telephone company were offset by another blockbuster quarter for verizon wireless which added a record million subscribers,three
warm signs detected from distant icy world london a large icy rock at the edge of our solar system was warm at some point a finding that suggests planetary processes like volcanic activity astronomers say,three
robotic craft s launch delayed at least days nasa postponed for at least two days the launch of its robotic satellitechasing spacecraft because the target satellite temporarily lost reception of a key navigational signal the agency said yesterday,three
disney s iger says pixar deal unlikely walt disney co president bob iger said on wednesday that a new deal with pixar animation studios was unlikely and that the us media conglomerate,two
rice could be headed north to join seahawks the disgruntled receiver asked for a trade last week and holmgren confirmed monday the seahawks were looking into ways to acquire him from the oakland raiders,one
all of a sudden cal is loaded for bear call them the quotalmost ready for primetime quot bears or maybe you can call them more than that after tomorrow for the university of california the time is now or more specifically tomorrow afternoon when they take on topranked southern cal,one
security tightened after fan takes a plunge more security will be placed around the fields of play at the olympics after a man who wanted to send a loving message to his wife jumped into the diving pool the athens organizing committee said,one
summary europeans make iran offer the offer britain france and germany are offering iran a trade agreement and the chance to buy nuclear fuel in exchange for a promise to suspend enrichment of uranium,zero
wariner leads us sweep in with jeremy wariner leading the way the united states pulled off the first medal sweep of the olympics monday night in the meter run,one
hp pressured to sell pc business after ibm deal seattle reuters hewlettpackard co lta href qtypesym infotypeinfo qcatnewsgthpqnltagt will be under pressure to sell its personal computer business after ibms decision to sell its pc operations to chinas top pc manufacturer but analysts said the no computer maker would hold on to its billion pc division for now,three
foreclosure rate still high although fewer utahns are falling behind on their house payments the rate at which families in the state are losing their homes to foreclosure was the thhighest in the nation in the,two
telstra relaunches network reliability site telstra has relaunched a section of its website that allows customers to see current and past network reliability for the country and their own regions,three
lsuauburn rivalry could get new chapter ap ap auburn and lsu have played several nickname games in recent years the fire game the interception game the cigar game,one
allardyce makes most of meagre resources sam allardyce is continuing to prove you do not have to spend millions to feast at the top table the bolton manager s ethic is simple,one
open source on the line roundup linux shapes up as a software standard for cell phone networks also california sees security in open source,three
documentary focuses on kerry in vietnam ap ap john kerrys former crew mates vouch for his vietnam war heroics in a documentary being released in the midst of a campaign debate about his actions as a swift boat skipper,zero
not all qb questions answered matt gutierrez will start at quarterback for the university of michigan on saturday against miami ohio it s right up there with quotdog bites man quot on the surprise scale,one
an unknown giant flexes its muscles although virtually unknown in the us lenovo in talks to buy ibms personal computer business is chinas largest pc maker and the worlds fastest growing one,three
hooters air brings flights to rockford hooters air will begin offering nonstop flights out of the greater rockford airport in early to denver atlanta and las vegas officials said,two
wifi security update wpa wifi protected access products both access points and client air cards will soon be flooding the market this uses the advanced encryption standard aes which is compliant with the fips government security requirements,three
laser technique used to treat bad breath reuters reuters if brushing and mouthwash dont improvebad breath an israeli scientist may have the solution lasertreatment,three
us assault weapons ban set to expire ap ap ten years after it was born out of the carnage of three california mass shootings the federal assault weapons ban is fading out of existence monday,zero
kerry to hunt for male us votes as bush courts catholics afp afp us democratic presidential candidate john kerry will switch to macho politics when he makes an atypical hunting trip to rural ohio in a bid to woo traditionalist male voters while president george w bush courts catholics in pennsylvania less than two week before election day,zero
crematory operator may get years a former crematory operator accused of dumping bodies including those of tennesseans and passing off cement dust as their ashes has struck a plea deal that calls for up,two
nhl lockout forces allstar cancellation new york nov in another sign the nhl season is slipping away the league canceled its allstar game wednesday because of the lockout,one
japan to streamline defense forces to fight terrorism japan s prime minister sunday has vowed to make the country s defense forces better able to fight terrorism and any attackers who would use weapons of mass destruction,zero
mars rover s wheels are malfunctioning a steering problem disabled the mars rover spirit oct and the craft has not moved since spacecom reported wednesday spirit s rightfront and leftrear wheels did not operate as commanded nasa said in a statement tuesday,three
first test day one aus v nz stephen fleming s decision to bat first didn t look the correct one at first as michael kasprowicz ripped though the tourists top order taking all of the first three wickets to fall including fleming for a duck,one
voice said to be bin ladens criticizes saudis a recording broadcast thursday accuses the ruling dynasty in osama bin ladens saudi homeland of being the agents of infidels,zero
icahn enters hollywood picture hollywood entertainment corp discovered friday that it might have another suitor in the suddenly crowded field bidding to take over the wilsonvillebased video rental chain,two
vivendi universal raises profit forecast reuters reuters vivendi universal raised its earnings forecast as it reported a percent increase inunderlying thirdquarter profit on wednesday driven mainly bystrong mobile phone sales,three
enter your email pc world s already had a chance to test windows xp media center edition which was announced today in a big todo thrown by microsoft in los angeles,three
israeli captain is charged in shooting of palestinian girl military prosecutors charged an army captain today with five separate offenses after accusations by fellow soldiers that he repeatedly shot a yearold palestinian schoolgirl to make sure she was dead,zero
indonesian muslim cleric bashir claims innocence ahead of terror trial afp afp a hardline indonesian muslim cleric protested his innocence as he was taken to court amid blanket security to stand trial for involvement in the deadly bali and marriott hotel bombings,zero
medicare premiums to rise record pct washington medicare premiums for doctor visits are going up a record a month next year the bush administration says the increase reflects a strengthened medicare while democrats complain that seniors are being unfairly socked,zero
on football parcells had a plan and he stuck with it watching parcells use the media this week provided another example of why he s one of the greatest coaches in nfl history parcells has used his regular news conferences to send messages to,one
symantec to reinforce data protection companys upgrades will put a particular focus on protecting personal information from online thieves,three
patriots march into today s contest armed with straight wins as the new england patriots aim for their th straight win over two seasons today the miami dolphins are starting to notice,one
call of the wild next summer for dolce and gabbana ferre afp afp dolce and gabbana and gianfranco ferre both heard the call of the wild for next summer filling their readytowear collections shown here on friday with real and fake animal skins from big cats to crocodile python and kangaroo,zero
blast outside bangladesh opposition hq kills dhaka at least six people were killed and more than injured in a series of bomb blasts at a meeting of the main opposition awami league in the capital on saturday witnesses and news reports said,zero
nasa man faked safety checks an exemployee of the us space agency nasa has pleaded not guilty to charges he falsified reports of safety checks on the space shuttle discovery,three
pfizer s celebrex increased heart risk linked a woman walks past the pfizer headquarters in new york the pharmaceutical giant warned of an increased risk of heart attack for its drug celebrex,two
israel urged to limit military response ap ap the state department called on israel friday to limit its military response to a rocket attack by hamas that killed two small israeli children,zero
stockwell day points to aids story to explain arafat snub canadian press canadian press ottawa cp stockwell day is pointing to a published report that includes the suggestion that yasser arafat had aids in explaining why he didnt send condolences on the death of the plo leader,zero
plane of nascar team hendrick missing race fans wave american flags in the stands during the singing of the national anthem prior to the start of the nascar subway stock car race at martinsville speedway in martinsville va,one
humane society opens case against japan whaling in australian ltbgtltbgt sydney humane society international opened legal proceedings in australian federal courts on tuesday against a japanese whaling fleet that it charges has killed more than minke whales within australia s whale sanctuary over the past four years,zero
stewart wishes to serve term now martha stewart the lifestyle guru convicted of lying about the sale of shares she owned wants to begin her five month jail sentence as soon as possible,two
new dts surround encoders leverage os x xserve maccentral maccentral digital theater systems inc dts on wednesday announced the availability of two new audio software encoders aimed at audio professionals creating multichannel soundtracks for dvdaudio dvdvideo and cds the pro series surround encoder a standalone solution designed to work on mac os x and windowsequipped computers and the dts pro series network encoder which allows up to users on macs or windows computers to encode audio using an apple xserve and xserve raid system both encoders were announced earlier this year and are anticipated for release this month,three
security group sets baseline standard for firewalls four security software rivals are have teamed up to set a baseline standard for application security firewalls challenging others in the industry to join them,three
carly patterson paul hamm help define these games quick what athlete defines the olympics more than any other bruce jenner maybe carl lewis possibly jesse owens could be mark spitz nice choice,one
soldier militants die in renewed gaza fighting four palestinian militants and an israeli soldier were killed tuesday in the heaviest gaza fighting since yasser arafat s death raising the prospect that renewed violence could complicate a vote for his successor,zero
no tar heels make quick work of wofford both went for from beyond the arc for their first threepointers of the season and career highs for threepointers in a game reserve erlana larkins added points for the tar heels,one
exdetroit draft pick killed for mobile phone moscow reuters a young spartak moscow player has died in hospital from injuries after being attacked on his way home the russian ice hockey club said monday,one
marconi joins the wimax forum marconi is the latest big name to join the wimax forum which is expected to certify its first longrange wireless broadband products next year,three
manny passes field test with flying colors granted boston s manny ramirez isn t much as far as left fielders go he has the range of a monotone his throws have been known to spray like champagne,one
singapore air sets bln boeing order singapore reuters singapore airlines ltd the worlds second most valuable airline said on wednesday it planned to buy up to boeing co er planes worth about us billion to support growth plans,two
sources sprint nextel closing in on b deal sprint corp is in advanced talks to buy nextel communications inc for more than billion in a mostly stock deal sources familiar with the situation said today,three
democrat may be leading in wash race ap ap through all the counting and recounting in the closest governors race in state history republican dino rossi has held the slimmest of margins over democrat christine gregoire even picking up a few votes here and there as a tedious hand recount grinds on,zero
sudan expels british charity head the head of save the children in sudan has been expelled from the country over claims that the charity breached sudanese law by claiming warplanes dropped bombs near an aid centre in darfur,zero
