text,label
asian stocks edge up as dollar steadies reuters reuters the dollar strengthened above lastweeks record low against the euro on monday allowing sharesin shippers and steelmakers to take asian equity markets upbut nerves about the dollars direction capped stock gains,two
sap names new vp software maker names tom byrne as its national vice president for state and local sales marketing and partnership initiatives,three
ohio scientists develop armor for humvees ap ap the military is ordering more lightweight armor developed in ohio that protects troops in humvees from automatic weapons fire and grenades without slowing the vehicles,three
strobl top of heap in cup run austrias olympic champion fritz strobl upstaged teammate hermann maier and american bode miller in yesterdays second training session for this weeks mens world cup downhill race,one
bank sages stumped by economic riddles the bank of england s most prominent sages have admitted to being stumped by apparent paradoxes in the country s economic performance including inflation s fall to within an ace of missing its target,two
putin says russia working on new nuclear systems russia is working on new nuclear missile systems that other powers do not have in order to protect itself against future security threats president vladimir putin said wednesday,zero
battle not over but rossi on the brink after a season full of races labelled significant or a turning point sunday s malaysian grand prix looks to have been the real thing valentino rossi s victory combined with seventh for sete gibernau means that the italian now has one hand on,one
aol to sell secure id tags to fight hackers reuters reuters america online will begin offering tosell members a security device and service that has been usedto safeguard business computer networks the worlds largestinternet service provider said on tuesday,three
jboss aims high with enterprise middleware system december idg news service opensource vendor jboss inc on monday plans to formally announce a stack of middleware software designed to make it more competitive with the sophisticated products sold by companies like ibm bea systems inc,three
industry report apparel wolverine improves wolverine world wide inc maker of hush puppies shoes and merrell boots reported thirdquarter revenue of million a,two
war criminal opens eu doors for serbia eu diplomats said sunday that the transfer of a bosnian serb genocide suspect to the un war crimes tribunal will lead to closer ties between the eu and serbia and montenegro,zero
sports world denver dennis rodman the yearold former nba rebounding champion participated in an informal workout with the denver nuggets on thursday,one
swiss voters endorse limits on stem cell research swiss voters endorsed restrictive legislation on stem cell research sunday that forbids the cloning of human embryos and put switzerland on a par with some other continental european countries,zero
patriots once again beasts of afc east clinch title in ugly win ltbgtltbgt the patriots stats news steamroller has yet to meet an obstacle it can t obliterate jobhunting coordinators allegedly vengeful running backs,one
us accused of changing drilling rule ap ap the sierra club alleges in a lawsuit that the bush administration changed a rule so oil and gas producers could more easily drill under national parks from outside their boundaries,zero
google exceeds all expectations can it sustain strong runup sometimes when stocks soar it has nothing to do with investors genuine interest in the company s prospects they just buy because the stock is going up,two
tn lorry owners don t support strike new delhi the tamil nadu lorry owners federation has decided not to support the strike call given by all india motor transport congress against levy of a per cent service tax on freight booking agents,two
toshiba sues hynix on memory patents tokyo japans toshiba corp filed patent infringement lawsuits in japanese and us courts on monday against south koreas hynix semiconductor inc it said tuesday,three
oil dips below as iraq flow rises oil prices dipped below on tuesday in a third day of falls as a more optimistic iraq export picture helped unwind some of the supply worries that have lifted the market to historic levels,two
athletics i can t let athens agony destroy my life paula radcliffe insisted last night that her olympic disaster will not quotruin my life quot as she bids to rebuild her career,one
mcdowell tames old course in under st andrews scotland graeme mcdowell taking a page out of tiger woods book eclipsed the world nos and plus a host of celebrities by destroying st andrews old course with a recordequalling under on thursday,one
how an la city department fought off user resistance an administrator with the los angeles municipal government explains how his department was able to turn user resistance from the police and fire departments among others into an million purchasing and accounts payable system,three
pakistan spin india to defeat afp afp pakistan spinners shahid afridi and shoaib malik took seven wickets between them to bowl their side to a run win over archrivals india in the opening match of the triangular event here,zero
falluja battle erupts unrest spreads elsewhere falluja reuters a battle erupted near a mosque in northwest falluja on friday just hours after us marines said insurgents were now trapped in the south of the city,zero
gaddafi asks for bigleys release libyan leader colonel gaddafi has appealed for the british hostage in iraq ken bigley to be freed reports say,zero
ao smith lowers q year outlook electric motor maker ao smith corp lowered its thirdquarter and fullyear earnings estimates monday citing increased costs for raw materials and freight,two
atlantic city casino hotel workers strike atlantic city nj oct about casino hotel workers from more than half the city s casinos went on strike friday even though negotiators had reached a tentative agreement with three of the casinos,two
italian hostages in iraq released two female italian hostages seized in baghdad three weeks ago have been freed on tuesday and are safe italian prime minister silvio berlusconi says,zero
judge oks us airways plan to cut pay by the unraveling of the ailing airline industry picked up speed friday as a bankruptcy judge granted us airways authority to temporarily cut the pay of its union workers by percent comparing the airline s financial outlook to quota ticking fiscal time bomb,two
sony unveils wifi multimedia cli big oled screen b slick design longrunning battery,three
mervyn s reverses ban on kettles bells will be ringing at mervyn s department stores this holiday season after all store officials announced thursday in a sudden reversal of a ban on salvation army collection kettles,two
beijing paralympic games to be fabulous ipc president the th summer paralympic games in in beijing will be extremely successful and quotfabulous quot phil craven chief of the international paralympic committee ipcpredicted here on thursday,one
cassini closes in on titan summary oct nasa s cassini spacecraft will pass only km miles above the surface of titan today delivering the most detailed pictures ever taken of the mysterious methane covered moon,three
cataract hormone discoveries win awards ap ap a researcher who turned cataract surgery into a brief outpatient procedure and three scientists who illuminated how some hormones and vitamins act on the bodys cells have won prestigious medical awards,three
update syneron medical shares drop on rejection shares of syneron medical ltd a maker of cosmetic medical devices plunged percent tuesday morning following regulators rejection of its application for a cellulitesmoothing device,two
speedy plane checkin by mobile phone set for london reuters passengers wanting to skip airport queues will be able to check in for flights using their mobile phone beginning next year two european firms set to offer the service announced on tuesday,three
talkback is ripping a crime written by patrick norton on ltbgtltbgt i own quite a few coltrane cds mad jazz saxophone player from the s timeless if you ve never heard quota love supreme quot well you ve missed out,three
fearless freddie s hooked on funday arsenal s fredrik ljungberg belives sunday s clash at manchester united will be great fun for the highflying gunners arsenal can not only reach a halfcentury in unbeaten league games if they avoid defeat,one
politics of fear over vision explored on british television todays terrorism and security daily update new documentary series says danger from al qaeda is dramatically overstated,zero
sec charges experegrine execs with fraud the us securities and exchange commission filed civil suits on wednesday charging that six former top executives at the technology company peregrine systems committed massive accounting fraud,two
home depot quarterly profit rises reuters reuters home depot inc hdn the worldslargest home improvement retailer on tuesday said quarterlyprofit rose topping estimates as technology upgrades andother store improvements helped boost sales,two
swsoft teams with acronis to boost virtual servers firms sign joint development marketing deal for integrated product expected next year,three
twolves face distractions as season nears ap ap the minnesota timberwolves are among the favorites in the western conference largely because all the key players are back from last seasons team that nearly made the nba finals,one
dutch steel firm buying international steel group for billion philadelphia _ international steel group inc which includes the remains of the bankrupt bethlehem steel corp is being acquired by a dutch steel company for,two
nepali villagers flee after maoist threat kathmandu thousands of villagers have fled districts in nepal s remote eastern region following threats by maoist rebels to attack the area and set up a quotpeople s government quot human rights and local officials said yesterday,zero
china coal mine blast death toll rises to hope fades for missing afp afp the death toll from a devastating coal mine gas explosion in central chinas henan province rose to as hopes of finding survivors among a further trapped workers faded,zero
els miffed at pga stance els said the americanbased tour wants him to play in more events but he considers himself a global golfer quoti think they need to understand that i think the golfing world has changed,one
astros apologize for replay the houston astros apologized to the cardinals on monday saying they erred a day earlier by showing a replay of st louis reliever julian tavarezs tantrum on the stadium scoreboard,one
afghan kidnappers say government agrees deal kidnappers of three un workers in afghanistan said on wednesday the government had agreed to terms for their release despite indications from afghan and us officials that a compromise was not possible,zero
tivo earnings reflect cost of customer acquisition tivo s q earnings reflect the high cost of attracting new subscribers to its customer base the company lost million or cents a share on revenue of,three
anderson in frame after a change of luck at last russell anderson is right not to dwell on why he has been given the opportunity to revive his scotland career since it means risking being seen as someone revelling in the misfortune of others,one
whose ad is this advertisers play with web films new york reuters when the manager of a coinoperated laundry seduces a mother and daughter and convinces them to skip town theres bound to be trouble or perhaps a movie plot,three
filenes basement markdown policy gets a makeover after years the downtown boston filenes basement store has quietly altered its yearold world famous quot automatic markdown policy making consumers wait longer to snare the steepest discounts,two
henman thrives on lone mission for so long written off as a perennial contender at wimbledon but nowhere else tim henman has stood convention on its head this year,one
us to import million flu shot doses washington reuters us health officials taking another step to ease the seasons flu shot shortage approved the importation of up to million flu shot doses from europe on tuesday for patients willing to sign a consent form,two
sprint nextel stocks up on merger reports ap ap wall street was abuzz friday over a potential merger between sprint and nextel though the companies declined to comment on a slew of news reports that they are negotiating to combine to create a celluar provider that would almost rival cingular wireless and verizon wireless in size,three
spitzer alleges corruption in insurance trade albany ny the man who made wall street reform its ways is now charging widespread corruption in the insurance industry he alleged that brokers have been taking payoffs from insurance companies to steer,two
excabinet minister caught up in marsh corruption scandal lord lang of monkton the president of the board of trade in the last conservative government is under pressure to resign from the board of marsh amp mclennan the insurance broker accused of corruption,two
orange revolution after many years under the rule of the corrupted government there is a new hope for ukraine the new presidential elections among candidates the primary are the opposition candidate victor yushchenko reformer which served as the prime minister in the past and was allegedly poisoned month before the first tour of the elections and the governments candidate victor yanukovich twice convicted in the past of rape and organized robbery currently serving as the prime minister having strong ties with mafia clans and holding in iron fist authorities across ukraine,three
un envoy decries excessive violence in moving sudanese refugees the united nation s envoy to sudan has criticized the sudanese government for using what he says is quottoo much violence quot to relocate thousands of people displaced by the conflict in darfur,zero
jeanne leaves at least million without power more than million households and businesses across florida power amp light co s area don t have electricity because of hurricane jeanne fpl said sunday morning,two
jones to buy barneys in mln deal new york reuters midpriced clothing retailer and maker jones apparel group inc lta href targetstocksquickinfofullquotegtjnynltagt said on thursday it was buying barneys new york inc lta href targetstocksquickinfofullquotegtbnnyobltagt in a deal worth million as a move to expand into luxury apparel retailing,two
team ninja developing for ps in a recent interview with ign xbox team ninja head tomonobu itagaki hinted that the renowned japanese developer is planning at least one game for either the ps or nintendo revolution,three
ortiz keeps red sox alive with timely home run in game pm this is it if the red sox are ever going to do something it s got to be now it s the bottom of the fifth inning in game two outs,one
no wake forest holds off arizona ap ap justin gray scored points for the second straight game and no wake forest beat no arizona on friday night in the championship game of the preseason nit,one
racism on trial in la liga the behaviour of barcelona fans at saturday s game against archrivals real madrid will be in sharp focus after spanish football fans covered themselves in shame with their racist chanting against the black england players on wednesday,one
oil steady as winter worries stem decline oil prices held steady on thursday as concern over lean heating fuel supplies in the united states and europe ahead of winter stemmed falls of nearly since late october,two
stephen dunngetty images com poor chone figgins he should have known he was in for a rough one when manny ramirez hammered a liner off his glove in the first inning of boston s win over anaheim in game of the american league division series,one
asia to fuel air travel growth global air traffic is set to be boosted in the next three years by a rise in travel between europe and asia thanks to growth in both china and india,two
premier delight at buy from kraft premier foods today emerged victorious in the bidding for another slice of british gastronomic history the owner of ambrosia creamed rice has,two
kremlin choice appears to win in chechnya grozny russia the russian governments choice for president of warbattered chechnya overwhelmingly won an election that opponents claimed was riddled with fraud news agencies reported monday citing preliminary results although the kremlin portrayed sundays election as a step toward stability terrorism cast a shadow over balloting with the downing of two russian airliners five days earlier,zero
no usc routs no arizona st ap ap nobody could call southern california lucky after this game dominant would be a better description a week after getting past california despite being badly beaten statistically no southern cal took command early against arizona state and routed the thranked sun devils saturday,one
colts thrive during grueling fourgame stretch indianapolis colts defensive tackle montae reagor could feel the weariness long before thursday s game at detroit the constant hits the barrage of meetings the quick pivots from game plan to game plan had already worn down his body and mind,one
not normal routine for gymnastics the gymnastics competition at the olympic games produced some extraordinary performances but ultimately was overshadowed by judging controversies that pitted nation against,one
denmark to claim north pole hopes to strike oil reuters reuters denmark aims to claim the north poleand hunt for oil in high arctic regions that may become moreaccessible because of global warming the science ministry saidmonday,three
japans foreign reserves hit record high in august afp afp japans foreign exchange reserves at the end of august rose billion dollars from july to a record billion dollars for the fourth consecutive monthly rise the finance ministry said,two
mets to have a new home on cable time warner cable and comcast corporation announced on tuesday that they had reached an agreement with sterling entertainment enterprises llc see to form a new,two
should google blame foot in mouth disease or evil bankers ltstronggtanalysisltstronggt lost in space,three
veritas to buy email company kvault veritas software corp vrtso quote profile research the largest independent us storage software provider said on tuesday it will buy email backup company kvault software ltd,three
cingular at ampt wireless at ampt agree on services branding atlanta preparing for the acquisition of at ampt wireless cingular has committed to a million deal to buy network services from at ampt cingular said monday,two
packers lead rams after one quarter ap ap brett favre started his th straight regular season game monday night but it was green bays defense that gave the packers a firstquarter lead over the st louis rams,one
elan corp shares jump ireland s major pharmaceutical firm elan corp plc said tuesday it plans to pay us million euro million to resolve a us classaction lawsuit and a related investigation by american federal regulators into alleged accounting malpractice,two
police break up rally protesting belarus referendum police in minsk broke up a strong crowd demonstrating against a referendum that approved allowing belarussian president alexander lukashenko to stay in power for another term a reuters witness said,zero
health highlights sept here are some of the latest health and medical news developments compiled by editors of healthday injuries rampant in us study says injuries kill americans each hour a new government report says that figure translated into people in alone with no age group gender or race exempt said the first national report for both fatal and nonfatal injuries released thursday by the us,three
dollar slide has only a muted shortterm impact on eads ceo beijing the dramatic fall of the dollar against the euro will would have only a muted shortterm impact on europe s largest defense company but if sustained it would affect future profitability the head of eads said,two
uns annan iraq war done little to halt terrorism reuters reuters the iraq war has done little to increasesecurity across the world or halt the activities ofinternational terrorists united nations secretarygeneral kofiannan said sunday,zero
stock benchmarks in asia fall mumbai japan s nikkei stock average fell for the first day in four after brokerages cut their ratings on the companies citing concern that earnings growth may slow,two
anschutz purchases journal newspapers philip f anschutz denver billionaire and dc united investor yesterday announced the purchase of the journal newspapers inc the alexandria publisher of three washington area suburban daily,two
boston s dominant play has curse on life support they are suffering inexplicable breakdowns and unaccountable disasters this used to be the boston red sox in october now it is the teams they are playing,one
oil sheds heating oil supplies rise london reuters world oil prices fell nearly a barrel on wednesday shedding percent as a largerthanexpected build in us heating stocks soothed worries about a winter fuel deficit,two
vandeweghe s uncommon ways bear results from jr rider to nikoloz tskitishvili to dennis rodman nuggets general manager kiki vandeweghe has raised many eyebrows with his moves,one
stocks seen flat gdp oil data in focus new york reuters us stocks looked to open little changed on wednesday after staging a late rally in the previous session with investors focused on key economic and oil data as crude drifts near a barrel,two
hong kong emerge as dominant force in fencing athens reuters a third gold medal for chui yee yu rounded off a rewarding day for hong kong at the paralympics as they emerged as the dominant force in wheelchair fencing,one
verplank tway to represent us seville spain south africa will underline their strength in depth if trevor immelman and rory sabbatini can retain their title at the wgcworld cup of golf at seville s real golf club,one
iraq asks major donors to release cash tokyo oct nnn iraq s deputy leader barham saleh on wednesday urged donors to release the aid money they have pledged saying it is the key to destroying terrorism in his troubled country,zero
surprise victory in philippines puts crack in dynasty tradition ilagan philippines the governor of isabela province grace padaca looked out at the misty rice fields from the tiled terrace of her official residence and said she never expected to call the mansion her home,zero
lehman to be next captain the pga of america is expected to introduce tom lehman as the next us ryder cup captain in a news conference at amelia island today,one
sharapova on track for third successive title zurich reuters wimbledon champion maria sharapova kept on course for a third successive wta title on saturday beating fellow russian elena dementieva in the semifinals of the zurich challenge,one
halflife a tech masterpiece its been six years since valve corp perfected the firstperson shooter with halflife video games have come a long way since with better graphics and more options than ever still relatively few games have mustered this ones memorable characters and original science fiction story,three
fedup americans eyeing canada canadian officials are reporting that their governments immigration web site has been swamped with traffic since george w bush gave his acceptance speech on wednesday missing links,three
former dictator pinochet ordered to stand trial for murder ltbgtltbgt santiago afp a chilean judge ordered former dictator augusto pinochet to stand trial on murder and kidnap charges linked to his role in operation condor a conspiracy of s south american dictatorships to eliminate opponents,zero
mello ousts fish gains quarters delray beach after wondering out loud at times why he couldn t get the ball over the net mardy fish had little reaction the final time he hit one short,one
fighting in fallujah nears end us and iraqi security forces scoured fallujah for remaining insurgent fighters and pounded the citys southernmost neighborhoods with heavy artillery and bombs late sunday night as military commanders declared victory seven days after launching their largest operation since the usled invasion of iraq in march,zero
superstar kewell remains centre of attention socceroo forward harry kewell loosens up by tossing around a ball at bondi beach yesterday photo craig golding there were half a dozen socceroos standing on a raised platform in sydney s,one
report glazer soccer bid near malcolm glazer tycoon owner of the tampa bay buccaneers reportedly plans to bid more than billion to take control of british icon manchester united the world s richest soccer team,one
columnists seeds of disaster internet explorers problems can be traced to microsofts shortsightedness during the browser wars of the s is the company sowing tomorrows security woes today,three
imac g in pictures the new imac as seen in these photos taken at the san francisco apple store places the computers innards behind a inch or inch flatpanel monitor,three
fusion reactor decision stalled six nations planning to build the worlds biggest nuclear fusion reactor fail to agree where to site the facility,zero
bush asked to nudge musharraf on pakistans democratic future afp afp us president george w bush should find out how pakistan president pervez musharraf plans to restore civilian rule in his country during their talks this weekend expected to be dominated by terrorism analysts say,zero
its a first for woods bloomfield township mich as for choosing a leadoff man how did european captain bernhard langer come up with paul casey to go against tiger woods,one
oil prices breach us a barrel toronto crude oil prices hit an alltime high tuesday pushing past the psychological barrier of us per barrel during asian trading,two
