text,label
motorola expects strong sales growth reuters reuters motorola inc the worldssecondlargest mobile phone maker said on tuesday it expectsto sustain strong sales growth in the second half of thanks to new handsets with innovative designs and features,three
cemex to buy rmc for usbil london mexico s cemex the world s thirdlargest cement maker has agreed to buy britain s rmc group for around bil us,two
oracle releases delayed security patches oracle corp released security patches this week that plug several vulnerabilities reported last month in its database software and other products,three
messina held by palermo heavy rain made for difficult playing conditions and it was not until the latter stages that the teams went close to breaking the deadlock but on both occasions they struck the woodwork,one
opec ready to agree output cut opec looks set to agree a cut in the rampant quotabusting which its members say has caused oil prices to fall in recent months,two
kidd cleared to do some work on court ap ap jason kidd was cleared for individual noncontact drills to get his surgically repaired left knee ready for the nets season,one
airlines want end to airport control ottawa should end the monopoly the airports hold over the airlines to reduce the price of landing at canadian airports especially at lester b pearson international airport in toronto says the head of the international air transport association,two
the us climate change vision quotthe issue of climate change respects no border its effects cannot be reined in by an army nor advanced by any ideology climate change with its potential to impact every corner,two
peyton manning has td passes as colts beat bears nfl week peyton manning threw for yards and four touchdowns to help the indianapolis colts win their third straight game a victory over the chicago bears,one
ecommerce sales rise in second quarter washington reuters us retail sales over the internet rose percent in the second quarter of and gained percent compared with the same period last year as consumers continued to turn to ecommerce to make purchases a government report,three
news india mulls tough id rules for cybercafs internet cafs in parts of india face closure if new regulations forcing them to provide police with names and addresses of all their customers are introduced under the new rules visitors to internet cafs will have to show their id cards or be photographed,three
video game sales seen pausing after record video game sales soared to a record billion last year but the days of strong growth are on pause as players await a new generation of consoles,three
tiger ready for fun week after return he actually considered floating away into retirement with his new bride aboard his yacht privacy never to be seen on a golf course again,one
web scribe ranks olympic lastplace losers reuters reuters for those who believe the adage allolympic athletes are winners a canadian man has dedicated thepast days to proving you wrong,three
oil holds firm heating fuel woes persist london reuters oil prices held strong above a barrel on wednesday as worries over a winter supply crunch countered expectations that high fuel costs would curb growth in petroleum demand next year,two
newsmakernamibia s nujoma to stand down but stay in saddle namibia s founding president sam nujoma is to stand down in march after this week s elections but will remain a lynchpin of his country s politics as president of the ruling swapo party,zero
oil up on winter weather worries london reuters oil prices rose a dollar on friday as worries a cold spell in the united states could erode already depleted winter fuel inventories spurred the market higher,two
russia to hold yukos auction moscow reuters russia said on friday it would go ahead with an auction to sell the key asset of embattled oil company yukos despite a us bankruptcy court decision to block it for several days,two
search companies vye for the desktop all the major web portals seem to be rushing delivery on one product this holiday desktop search software microsoft plans to introduce a test version of its desktop search application in the coming days meeting its stated deadline by a nose,three
bear stearns bond unit is under sec investigation bear stearns has received subpoenas from federal investigators looking into its municipal bond business the company reported in documents filed with the securities and exchange commission yesterday,two
janco partners initiates google with sell rating reuters reuters janco partners on thursdayinitiated coverage of google inc with a sell rating and atarget price of saying while the worlds no web searchproviders fundamentals are strong its current stock valuationis too high,three
beware deadly asteroid set to hit earth mumbai the earth will have a close shave with one of the largest known potentially hazardous asteroids called toutatis on wednesday nehru planetarium senior scientist bharat adur said,three
weak demand leads google to lower its sights google slashed the number of shares and concluded its unorthdox online auction by accepting a price well below its original target,zero
kobe bryants defense wants rape charge dismissed eagle colo reuters attorneys for basketball star kobe bryant asked a judge to dismiss a rape charge against their client arguing prosecutors did not disclose that one of their expert witnesses had information that could help bryant,one
japans smfg bids billion for ufj tokyo reuters sumitomo mitsui financial group inc lta href targetstocksquickinfofullquotegttltagt laid out a billion bid for ufj holdings lta href targetstocksquickinfofullquotegttltagt on tuesday challenging a rival offer by mitsubishi tokyo financial group lta href targetstocksquickinfofullquotegttltagt to form the worlds biggest bank,two
wizards late magic stops bobcats charlotte nc oct ticker the charlotte bobcats fell short in a wild franchise debut at home antawn jamison hit a turnaround jumper in the lane with seconds remaining to lift the washington wizards,one
microsoft launches new search engine redmondbased microsoft corp on thursday launched a test version of its new msn search service hoping to compete with google and other major web search services,three
senior manila police officer slain in philippines ambush manila one of manila s most senior police officers has been killed in an ambush outside his office his commander said unknown gunmen armed with assault rifles attacked senior superintendent manolo martinez,zero
economic view whoever wins more taxes may be the only way out t s often forgotten that president ronald reagan signed a bill to raise taxes in the early s after first cutting them,two
after a sloppy start the irish upset michigan with a burst of speed darius walker sprinted around right end and ran untouched into the south end zone for a yard touchdown saturday,one
arch coal profit off but coal sales up new york reuters arch coal inc lta href targetstocksquickinfofullquotegtacinltagt the secondlargest us coal producer said on friday that thirdquarter profit fell slightly as rail disruptions and hurricanerelated work delays affected mining operations,two
delay urged on lng facility massachusetts attorney general thomas f reilly is urging federal regulators to hold off on approving a proposed fall river liquefied natural gas terminal reilly told the federal energy regulatory commission that it quotshould defer any decision on the weavers cove facility until true siting standards are in place and a regional plan is developed quot that evaluates whether the taunton river,two
un calls on iran to freeze nuke enrichment plans reuters reuters the un nuclear watchdog called on iranon saturday to immediately halt activities related to uraniumenrichment a process that can be used to make atomic weapons,zero
downing provides return on mcclaren s gamble in a week in which one of their former players rechristened himself g to distance himself from the past middlesbroughs attempts to rewrite history took another step forward in athens,one
ibm fleshes out power line ibm quote chart upped the ante against rivals hp quote chart and sun microsystems quote chart in the server market by adding three new machines based on its power processor two of which can run virtual servers on a single machine,three
medarex pfizer team up for m project medarex inc a princeton nj biotechnology company could receive up to million under a global collaboration deal it signed with new yorkbased pfizer inc,two
acceptable price for oil barrel us dollars venezuelan president hugo chavez said today in moscow that us dollars per barrel of oil is an acceptable price adding that opec oil petroleum exporting countries must make sure the price does not drop below us dollars,two
nokia revamps vpn system security newsfactor newsfactor nokia nyse nok has upgraded the security and functionality of its secure access system virtual private network vpn platform,three
spy agency reform thrown into doubt reuters reuters an agreement reached on saturday bycongressional negotiators on postsept intelligence reformswas thrown into doubt by resistance by some republicans in thehouse of representatives,zero
sweden to save sinking town sweden is to move the northern town of kiruna to prevent it sinking into a hole left by iron ore mines,three
muslim envoys off to baghdad in bid to free british hostage liverpool england britain s leading muslim organisation dispatched two envoys to iraq hoping to help secure the release of a british engineer taken hostage by extremists eight days ago,zero
sloppy sox are sunk in seattle forget about the curse and the sports illustrated jinx the red sox last night fell victim to a brief revival of their firsthalf defensive woes and a native american pitcher who invokes the spirit of his lakota sioux ancestors the same tribe that helped annihilate general custer at little big horn,one
graeme souness profile as a player souness built up a fearsome reputation as a hard man of the game many feel that his style of play with more than the odd cynical foul thrown in could never fit into the modern game,one
it takes time to judge the true impact of new technology about this time last year i wrote a column following up on some pieces id written earlier to see what if anything new had happened to those topics the reaction i heard afterwards convinced me that revisiting old news was a worthwhile exercise in general its too easy for tech reporters to lose sight of how a product works over time in the real world as opposed to a brief trial in a reviewers hands,three
design and coding for the complete package wmw conf design and coding for the complete package wmw conf roger sooley from compstar was up first his forum name is rogerd he first goes into the question about building the software yourself or using a prebuilt software application the first question you need to ask is is your business,three
us panel hears case of terror suspects ap ap two prisoners including a man accused of appearing in an alqaida film about the uss cole bombing went before military review tribunals at the us outpost in guantanamo bay cuba on thursday a pentagon official said,zero
ukraine speaker keep poisoning out of campaign reuters reuters ukraines influential parliament speakercalled on monday for a scandal over the poisoning of oppositionleader viktor yushchenko to be kept out of the countryspresidential election campaign,zero
hunters off the hook for bison declines big game hunters may be off the hook in the latest twist of a prehistoric whodunit that tries to explain why bison populations sharply crashed thousands of years ago,three
bayliss tips rossi for big race world champion valentino rossi will be unbeatable in sunday s australian motorcycle grand prix according to australian troy bayliss,one
cubs wildcard hopes take a hit the chicago cubs were one strike from a key victory but wound up with another agonizing defeat that damaged their drive to the playoffs,one
update crude slips on nigeria worries crude oil futures in new york gained thursday for the ninth time in days but again failed to settle above as questions remained about the progress of truce talks in nigeria and the recovery of production in the gulf of mexico,two
mbeki ivory coast parties agree new peace push abidjan ivory coast reuters south african president thabo mbeki said monday he had reached agreement with all sides in ivory coasts conflict on measures which should speed up implementation of a frenchbrokered peace accord,zero
united states slovakia team usa finally showed some energy in the world cup of hockey beating slovakia friday for its first win in the tournament bill guerin jason blake and bryan smolinski scored for the younger quicker,one
american league playoff game summary anaheim at boston the headline on friday s edition of the boston herald read quotgo yanks quot indicative of how badly the red sox faithful yearn for a rematch of last year s alcsprior to the game scioscia announced that suspended outfielder jose guillen would not be,one
us iraqi forces take key samarra buildings washington reuters us and iraqi troops took control of government and police buildings in samarra early on friday after insurgents had undermined security in the iraqi city the us military said,zero
put up or push off city patrician tells bid em up bruce eight months of simmering tension at investment bank lazard erupted this week as its patrician chairman told the wall street legend he hired to run the bank to take it public by next june or quit,two
cairo hosting arafat funeral a military funeral for the palestinian president yasser arafat will be held in the egyptian capital cairo this morning after the funeral president arafat s coffin will be flown by helicopter to ramallah for burial,zero
resignation of china s senior leader appears imminent jiang zemin china s military chief and longtime senior leader may formally step down on sunday putting president hu jintao in full command of the chinese army state and,zero
relentless hewitt in quarters lleyton hewitt continued his redhot run to reach his fifth straight us open quarterfinal at flushing meadows today australia s champion obliterated unseeded slovak karol beck in hr min,one
jury in klesch litigation returns verdict in favor of liberty ltbgtltbgt englewood colo sept prnewswirefirstcall liberty media corporation announced that the jury in klesch amp company ltd,two
time to put up shut up as incredible as it sounds the giants have hit mustwin territory already they have played one game lost it badly and have spent the ensuing week talking as much,one
pope struggles at shrine mass lourdes france a sick man among the sick pope john paul ii struggled yesterday through sunday mass at a french shrine that draws desperate people seeking miracle cures the yearold pontiff gasped trembled and asked aides for help during the hour service in the sizzling heat,zero
tmobile roaming worldwide via wba tmobile has announced that it has joined the wireless broadband alliance s new wifi roaming agreement to allow worldwide roaming for mobile users,three
ual agrees to independent agents to oversee pension funds washington bankrupt united airlines has agreed to appoint an independent party to manage its employee pension funds prior to september in an agreement with the us labor department,two
rice eager to show seahawks he s still young enough jerry rice still wants to run down the middle of a football field dodging tacklers at an age when many athletes have scrambled to new careers,one
baseball rare player strike grips japan tokyo it leads the tv news and everyone from schoolchildren to the prime minister is talking about it the first baseball strike in japanese history has gripped the nation and rekindled interest in what was,one
update french firms sagem snecma plan to merge french aircraft engine maker snecma snecpa quote profile research and defence equipment group sagem sagmpa quote profile research,two
red hat opens office in china red hat on thursday announced the opening of its first office in china in the nation s capital beijing the company said it will be working with industry partners such as hewlettpackard ibm intel and,three
sprint nextel close to sealing merger sprint corp and nextel communications have tentatively agreed on key terms in a us billion billion merger deal that would create a giant mobile phone carrier with nearly million subscribers,two
cnn chooses excbs official as its us chief cnn appointed jonathan klein who used to be the no executive at cbs news as president of its domestic network,two
nintendo operating profit up percent reuters reuters japanese video game maker nintendo coltd reported a percent rise in operating profit for thefirst half on thursday and raised its sales target for a newkeenly awaited portable game player,three
fannie mae in deal to hike capital reuters reuters embattled mortgage finance companyfannie mae agreed to keep billions of dollars more cashon hand while it corrects accounting problems its governmentregulator said on monday,two
australia s howard to campaign on record latham pledges change australians will go to the polls on oct with prime minister john howard campaigning for a fourth term on his record of economic management low interest rates and national security,zero
clemson south carolina players suspended for fight six clemson players and six south carolina players were suspended one game by their conferences on monday for participating in a brawl during a game between the instate rivals on nov,one
daimlerchrysler operating profit rises frankfurt reuters daimlerchryslers lta href targetstocksquickinfofullquotegtdcxgndeltagt thirdquarter operating profit rose percent just below analyst expectations as gains at us arm chrysler helped offset weaker earnings at premium carmaker mercedes,two
dulko reaches quarters sugiyama rubin bounced in bali openers bali indonesia sports network seventhseeded argentine gisela dulko moved into the quarterfinals while thirdseeded japanese ai sugiyama and bali runnerup chanda rubin were a pair of openinground losers wednesday at the wismilak,one
bush cheney concede iraq had no wmds washington president bush and his vice president conceded thursday in the clearest terms yet that saddam hussein had no weapons of mass destruction even as they tried to shift the iraq war debate to a new issue whether the invasion was justified because saddam was abusing a un oilforfood program,zero
pirates release pitcher nelson figueroa ap ap the pirates unconditionally released righthanded pitcher nelson figueroa on tuesday,one
motorola releases razr phone via cingular ap ap motorola inc announced the us release tuesday of its razr v the ultrathin cell phone that it has promoted heavily as the star of its portfolio of new handsets,three
pm arrives for apec summit amid noisy protests touching down in a city rocked by large noisy protests prime minister paul martin has arrived in santiago chile for this year s summit of apec leaders,zero
dark arts of spin evident in phoney war for abbey the phoney war over the fate of abbey grinds on along the way on all sides it is producing its predictable crop of knowing winks and destabilising nudges,two
angry putin rules out chechen talks as crowds rally beslan russia reuters russian president vladimir putin rejected any dialogue with chechen separatists blamed for at least deaths in the school hostage siege as hundreds of thousands joined rallies against terrorism,zero
interstate bakeries files for bankruptcy new york reuters interstate bakeries corp filed for bankruptcy on wednesday after struggling with more than billion in debt and weak demand for bread products amid the popularity of lowcarbohydrate diets,two
content management systems and seo a powerful mix content management systems and seo a powerful mixsearch engine optimization revolves around providing useful unique content on your website and making sure that search engines can find and understand it easily organic seo as it is called puts emphasis on optimizing hundreds of keyword rich content pages as spiderbait,three
big lead for washington as angelos blocks home the montreal expos appear to be heading to a new home in washington but the most pressing concern is the negotiation to compensate orioles owner peter angelos,one
juventus real madrid win matches ap ap pavel nedved scored the winner as juventus edged bayern munich in the first meeting between the two storied clubs maintaining its perfect record in the champions league,one
united stuns metrostars earnie stewart and alecko eskandarian score as dc united defeats the metrostars on saturday night taking a commanding lead in their firstround playoff series,one
accreditation team criticizes u of ill ap ap a panel from the association that accredits the university of illinois chastised the school wednesday for failing to resolve the longstanding controversy over its american indian mascot which supporters argue is an honored tradition and others say is racially offensive,one
a big beat for cardiodynamics the medical device maker receives fda clearance for new heart monitoring technology,two
new zealand court rejects air nzqantas alliance update new zealand s high court rejected a proposed alliance between air new zealand ltd the nation s largest airline and australia s qantas airways ltd,two
home loan fraud grows the fbi has fielded almost twice as many complaints from mortgage lenders so far this year as it did for all of the bureau reported friday,two
a space race to change the world usa today more than eight years ago a new space race began with the announcement of the x prize competition based on prizes that inspired the development of aviation in the early th century the x prize was started to encourage private space travel through a competition to build the first reusable spacecraft,three
altria considers breakup altria group inc the parent company of cigarette maker philip morris and kraft foods inc may split into three separate units to improve shareholder value according to chief executive louis camilleri,two
gaza strip mortar attack injures israeli soldiers update a mortar attack on an israeli military post in the southern gaza strip injured soldiers the israel defense forces said israeli troops hours later raided the khan younis refugee camp the haaretz newspaper reported,zero
sampanis stripped of bronze greek weightlifter leonidas sampanis is stripped of his bronze medal after testing positive for drugs,one
docomo motorola partner on g phone us and japanese mobilephone giants motorola and docomo are teaming up to develop a foma handset that runs on gsmgprs networks the thirdgeneration device will allow japanese business users,three
for grandpa fulham fans would have been singing the late elvis hit the wonder of you to their player elvis hammond if not for frank lampard spoiling the party with his dedication to his late grandfather,one
mercenaries coup trial begins the trial of men accused of plotting to topple equatorial guineas president opens in malabo on monday,zero
gates ballmers pay hold at about paychecks stay the same for the top two but compensation changes for other microsoft workers as stock grants replace options,three
auteur zhang ready for athens surprise show quotthe world gave me eight minutes and i will give the world a surprise quot said chinese director zhang yimou who is gearing up for a show at the closing ceremony of the athens olympics,one
the flying elvises not by decree but by unanimous approval the yankees moved on yesterday all but ignoring the postseason position they had just secured,one
jpl team visits nasa shuttle program when congress passed the billion spending bill last weekend it allotted billion for nasa including nearly full funding of projects related to the president s vision for space exploration,three
amd sheds light on dualcore plans upcoming opteron chips will occupy the same space as singlecore models,three
os stuff devil rays javy lopez drives in four runs daniel cabrera becomes the first rookie to win games this season and the orioles hold tampa bay to two hits in an victory wednesday night,one
fda prompts pfizer to yank viagra ads the fda thinks those quotwild thing quot ads for viagra need to be domesticated the ads feature a balding middleage man with a beautiful blond woman and a voiceover asking quotremember that guy who used to be called wild thing,three
danforth want to spend time with my wife us ambassador to the united nations john danforth wants to return to private life when president george w bush begins his second term,zero
sap touts netweaver enhancements sap is rolling out a new set of java and business intelligence enhancements to its netweaver middleware and integration stack,three
it may have been the last title but it was hardly the best decades of derisive chants combined with the nations obsession with the date make it natural to believe was the highwater mark for the red sox team that won five of the first world series,one
australians head to indonesia australians are continuing to pack their bags and head to indonesia for christmas despite warnings terrorists are planning a bomb attack in the country,zero
canada confirms second mad cow case reuters reuters a final laboratory test hasconfirmed an alberta dairy cow had mad cow disease the secondcase canada has found in its herd an industry source briefedby veterinary officials said on sunday,two
senate moves forward with corporate tax cuts after a daylong attempt to delay action the senate moved forward sunday with debate on a billion corporate tax cut package,two
odds and ends when hunter jim mick went into the forest to bag himself a deer he never expected to come out emptyhanded and badly bruised the yearold bowhunter was treated for injuries,one
